,text
63,"008) 18:847 –8536. Wolf AM, Busch A, Kuhlmann HW, et al. Histological changes in liver of morbidly obese patients: correlation with metabolic parameters. Obes Surg. 2005;15:228 –37. 7. Harnois F, Msika S, Sabate J-M, et al. Prevalence and predictive factors of non-alcoholic steatohepatitis (NASH) in morbidly obese patients undergoing bariatric surgery. Obes Surg. 2006;16:183 –8. 8. Aidonopouios AP"
64,", Papavramidis ST, Zaraboukas TG, et al. Gallbladder findings after cholecystectomy in morbidly obesepatients. Obes Surg. 1994;4:8 –12. 9. Fobi M, Lee H, Igwe D, et al. Prophylactic cholecystectomy with gastric bypass operation: incidence of gallbladder disease. ObesSurg. 2002;12:350 –3. 10. Dittrick GW, Thompson JS, Campos D, et al. Gallbladder pathology in morbid obesity. Obes Surg. 2005;15:238 "
65,"–42. 11. Liew P-L, Lee Y-C, Lin Y-C, et al. Comparison of artificial neural networks with logistic regression in prediction of gallbladder disease among obese patients. Dig Liver Dis. 2007;39:356 –62. 12. Seinige UL, Sataloff DH, Lieber CP, et al. Gallbladder disease in the morbidly obese patient. Obes Surg. 1991;1:51 –6. 13. Pagliarulo M, Fornari F, Fraqueli M, et al. Gallstone disease and relate"
66,"d risk factors in a large cohort of diabetes patients. Dig Liver Dis. 2004;36:130 –4. 14. Fraquelli M, Pagliarulo M, Colucci A, et al. Gallbladder motility in obesity, diabetes mellitus and coeliac disease. Dig Liver Dis. 2003;35:S12 –6. 15. Sanyal AJ, Campbell-Sargent C, Mirshahi F, et al. Nonalcoholic steatohepatitis: association of insulin resistance and mitochondrial abnormalities. Gastroenter"
67,"ology. 2001;120:1183 –92. 16. Chitturi S, Abeygunasekera S, Farrell GC, et al. NASH and insulin resistance: insulin hypersecretion and specific associationwith the insulin resistance syndrome. Hepatology. 2002;35:373 –9. 17. Nervi F, Miquel JF, Alvarez M, et al. Gallbladder disease is as- sociated with insulin resistance in a high risk hispanic population.J Hepatol. 2006;45:299 –306. 18. Lu S-N, C"
68,"hang W-Y, Wang L-Y, et al. Risk factors for gallstones among Chinese in Taiwan. J Clin Gastroenterol. 1990;12:542 –6. 19. Loria P, Lonardo A, Lombardini S, et al. Gallstone disease in non-alcoholic fatty liver: prevalence and associated factors. J Gastroenterol Hepatol. 2005;20:1176 –84.20. Sheen I-S, Liaw Y-F. The prevalence and incidence of cholecys- tolithiasis in patients with chronic liver di"
69,"seases: a prospective study. Hepatology. 1989;9:538 –40. 21. Liew P-L, Lee W-J, Lee Y-C, et al. Hepatic histopathology of morbid obesity: concurrence of other forms of chronic liver disease. Obes Surg. 2006;16:1584 –93. 22. Haffner SM, Miettinen H, Stern MP. The homeostasis model in the San Antonio Heart Study. Diabetes Care. 1997;20:1087 –92. 23. Brunt EM, Janney CG, Bisceglie AMD, et al. Nonalco"
70,"holic steatohepatitis: a proposal for grading and staging histologic lesions. Am J Gastroenterol. 1999;94:2467 –74. 24. Kleiner DE, Brunt EM, Natta MV, et al. Design and validation of a histological scoring system for nonalcoholic fatty liver disease. Hepatology. 2005;41:1313 –21. 25. Silverman JF, O ’Brien KF, Long S, et al. Liver pathology in mor- bidly obese patients with and without diabetes. "
71,"Am J Gastroenterol. 1990;85:1349 –55. 26. Gholam PM, Kotler DP, Flancbaum LJ. Liver pathology in mor- bidly obese patients undergoing Roux-en-Y gastric bypass surgery.Obes Surg. 2002;12:49 –51. 27. Dixon JB, Bhathal PS, Hughes NR, et al. Nonalcoholic fatty liver disease: improvement in liver histological analysis with weightloss. Hepatology. 2004;39:1647 – 54. 28. Liew P-L, Weu Wang, Yi-Chih L, et"
72," al. Gallbladder disease among obese patients in Taiwan. Obes Surg. 2007;17:383 –90. 29. Ruhl CE, Everhart JE. Association of diabetes, serum insulin, and C-peptide with gallbladder disease. Hepatology. 2000;31:299 –303. 30. Papadia FS, Marinari GM, Camerini G, et al. Liver damage in severely obese patients: a clinical-biochemical-morphologic studyon 1,000 liver biopsies. Obes Surg. 2004;14:952 –8"
73,". 31. Buchner AM, Sonnenberg A. Factors influencing the prevalence of gallstones in liver disease: the beneficial and harmful influences of alcohol. Am J Gastroenterol. 2002;97:905 –9. 32. Chu C-M, Lin D-Y, Liaw Y-F. Does increased body mass index with hepatic steatosis contribute to seroclearance of hepatitis B virus (HBV) surface antigen in chronic HBV infection? Int J Obes. 2007;31:1 –5. 33. Co"
74,"nte D, Fraquelli M, Fornari F, et al. Close relation between cirrhosis and gallstones. Arch Intern Med. 1999;159:49 –52.OBES SURG (2008) 18:847 –853 853"
